{
  "version": "1.0.0",
  "generatedAt": "2025-12-07T08:21:45.076537+00:00",
  "sourceFormat": "xml",
  "technologies": [
    {
      "id": "T001",
      "name": "Advanced Manufacturing Automation",
      "category": "Economic",
      "description": "Cutting-edge robotics and AI systems for automotive manufacturing",
      "prerequisites": [
        "T004"
      ],
      "requiredResources": [],
      "researchCost": 5000.0,
      "researchTime": 360,
      "effects": [
        {
          "target": "AutoFactory",
          "attribute": "ProductionEfficiency",
          "operation": "increase",
          "magnitude": 0.35,
          "description": "35% increase in automobile production efficiency"
        },
        {
          "target": "LaborForce",
          "attribute": "RequiredWorkers",
          "operation": "decrease",
          "magnitude": 0.25,
          "description": "25% reduction in required workforce"
        }
      ],
      "availableToClasses": [
        "BOURGEOISIE"
      ]
    },
    {
      "id": "T002",
      "name": "Precision Agriculture Systems",
      "category": "Economic",
      "description": "AI-driven farming systems with automated irrigation and harvest optimization",
      "prerequisites": [],
      "requiredResources": [],
      "researchCost": 3000.0,
      "researchTime": 240,
      "effects": [
        {
          "target": "WheatProduction",
          "attribute": "YieldRate",
          "operation": "increase",
          "magnitude": 0.25,
          "description": "25% increase in wheat yield per acre"
        },
        {
          "target": "ResourceConsumption",
          "attribute": "WaterUsage",
          "operation": "decrease",
          "magnitude": 0.2,
          "description": "20% reduction in water consumption"
        }
      ],
      "availableToClasses": []
    },
    {
      "id": "T003",
      "name": "Advanced Semiconductor Fabrication",
      "category": "Economic",
      "description": "Next-generation semiconductor manufacturing processes",
      "prerequisites": [],
      "requiredResources": [],
      "researchCost": 8000.0,
      "researchTime": 480,
      "effects": [
        {
          "target": "SemiconductorProduction",
          "attribute": "Quality",
          "operation": "increase",
          "magnitude": 0.4,
          "description": "40% increase in semiconductor quality and complexity"
        },
        {
          "target": "ProductionCost",
          "attribute": "Cost",
          "operation": "decrease",
          "magnitude": 0.3,
          "description": "30% reduction in production costs"
        }
      ],
      "availableToClasses": []
    },
    {
      "id": "T004",
      "name": "High-Efficiency Solar Technology",
      "category": "Economic",
      "description": "Advanced photovoltaic materials and manufacturing techniques",
      "prerequisites": [],
      "requiredResources": [],
      "researchCost": 4000.0,
      "researchTime": 300,
      "effects": [
        {
          "target": "SolarPanelProduction",
          "attribute": "Efficiency",
          "operation": "increase",
          "magnitude": 0.3,
          "description": "30% increase in solar panel energy conversion efficiency"
        }
      ],
      "availableToClasses": []
    },
    {
      "id": "T005",
      "name": "Advanced Steel Processing",
      "category": "Economic",
      "description": "Enhanced steel production methods with reduced environmental impact",
      "prerequisites": [],
      "requiredResources": [],
      "researchCost": 3500.0,
      "researchTime": 270,
      "effects": [
        {
          "target": "SteelProduction",
          "attribute": "Quality",
          "operation": "increase",
          "magnitude": 0.25,
          "description": "25% increase in steel quality"
        },
        {
          "target": "Emissions",
          "attribute": "CarbonOutput",
          "operation": "decrease",
          "magnitude": 0.35,
          "description": "35% reduction in carbon emissions"
        }
      ],
      "availableToClasses": []
    },
    {
      "id": "T006",
      "name": "Large Language Model Infrastructure",
      "category": "Control",
      "description": "The quintessential dual-use technology of the 21st century. In the hands of capital and state, LLMs enable unprecedented surveillance, narrative control, and automation of cognitive labor—a panopticon that writes its own propaganda. Yet the same technology, when seized by revolutionary forces, becomes a force multiplier: enabling small cells to code their own infrastructure, hack enemy systems, translate across languages, educate the masses, and achieve operational self-reliance that would otherwise require thousands of specialists. The question is not whether AI will transform society, but which class will wield it.",
      "prerequisites": [
        "T003"
      ],
      "requiredResources": [
        "R_COMPUTE_CLUSTER",
        "R_TRAINING_DATA"
      ],
      "researchCost": 15000.0,
      "researchTime": 720,
      "effects": [
        {
          "target": "KnowledgeWorkers",
          "attribute": "RequiredWorkers",
          "operation": "decrease",
          "magnitude": 0.40,
          "description": "40% reduction in required knowledge workers (journalism, legal, programming)"
        },
        {
          "target": "StateApparatus",
          "attribute": "SurveillanceCapacity",
          "operation": "increase",
          "magnitude": 0.50,
          "description": "50% increase in state surveillance—every communication parsed, every pattern detected"
        },
        {
          "target": "IdeologicalApparatus",
          "attribute": "NarrativeControl",
          "operation": "increase",
          "magnitude": 0.35,
          "description": "35% increase in ability to shape discourse through algorithmic curation"
        },
        {
          "target": "RepressiveApparatus",
          "attribute": "TargetingPrecision",
          "operation": "increase",
          "magnitude": 0.45,
          "description": "45% increase in ability to identify and track dissidents"
        },
        {
          "target": "ImperialRent",
          "attribute": "ExtractionRate",
          "operation": "increase",
          "magnitude": 0.20,
          "description": "20% increase in imperial rent extraction through platform monopolies"
        },
        {
          "target": "Contradiction",
          "attribute": "CapitalLabor",
          "operation": "intensify",
          "magnitude": 0.30,
          "description": "30% intensification of capital-labor contradiction as cognitive work is commodified"
        }
      ],
      "availableToClasses": [
        "BOURGEOISIE",
        "COMPRADOR_BOURGEOISIE"
      ],
      "unlocksTechnologies": [
        "T007",
        "T008",
        "T009",
        "T010"
      ],
      "dialecticalContradictions": [
        {
          "thesis": "Concentration of AI capability in monopoly capital enables total surveillance",
          "antithesis": "The same models, once leaked or replicated, give small groups capabilities of large organizations",
          "potentialSynthesis": "Democratized AI collapses the asymmetry between state and revolutionary forces"
        },
        {
          "thesis": "AI automates cognitive labor, creating mass technological unemployment",
          "antithesis": "Displaced workers have nothing to lose and technical skills to contribute",
          "potentialSynthesis": "Either managed decline into neo-feudalism or revolutionary seizure of productive forces"
        },
        {
          "thesis": "AI requires massive compute infrastructure controlled by capital",
          "antithesis": "Efficiency improvements and edge computing enable decentralized deployment",
          "potentialSynthesis": "Infrastructure becomes a key site of class struggle"
        }
      ]
    },
    {
      "id": "T007",
      "name": "Federated Open-Source AI",
      "category": "Liberation",
      "description": "The revolutionary seizure of AI capability. Decentralized, community-controlled language models running on distributed infrastructure, trained on curated datasets that center working-class perspectives and historical revolutionary praxis. This technology enables small cells to achieve capabilities previously requiring large organizations: automated code generation for secure infrastructure, real-time translation for international coordination, mass political education, and counter-narrative production—all without corporate or state surveillance. A single cadre with a laptop becomes as capable as a team of specialists.",
      "prerequisites": [
        "T006"
      ],
      "requiredResources": [
        "R_DISTRIBUTED_COMPUTE",
        "R_COMMUNITY_DATA"
      ],
      "researchCost": 8000.0,
      "researchTime": 540,
      "effects": [
        {
          "target": "MovementOrganization",
          "attribute": "CoordinationCapacity",
          "operation": "increase",
          "magnitude": 0.45,
          "description": "45% increase in movement coordination—AI handles logistics, translation, scheduling"
        },
        {
          "target": "Proletariat",
          "attribute": "ClassConsciousness",
          "operation": "increase",
          "magnitude": 0.30,
          "description": "30% increase in class consciousness through personalized political education at scale"
        },
        {
          "target": "CounterHegemony",
          "attribute": "NarrativeCapacity",
          "operation": "increase",
          "magnitude": 0.40,
          "description": "40% increase in ability to produce and distribute counter-narratives in all languages"
        },
        {
          "target": "MovementOrganization",
          "attribute": "TechnicalSelfReliance",
          "operation": "increase",
          "magnitude": 0.55,